{"authorizations":{"calibration_development_run_authorized":false,"dvc_commands_authorized":false,"dvc_push_authorized":false,"e0_m_authorized":false,"e0_u_authorized":false,"e7_learning_curve_run_authorized":false,"effective_in_payload":false,"git_commit_authorized":false,"git_push_authorized":false,"holdout_access_authorized":false,"locked_evaluation_authorized":false,"outcome_access_authorized":false,"post_2021_access_authorized":false,"scientific_network_authorized":false},"calibration_group_matrix":{"bloom_group_count":66,"bloom_group_key":["model_id","model_seed","horizon_months"],"bloom_group_target_universe_policy":"exact_identity_set_equality_no_partial_groups","bloom_groups_with_exact_complete_target_universe":66,"complete_target_count":2646,"complete_target_counts_by_target_year_horizon":{"2019":{"1":397,"2":371,"3":344},"2020":{"1":261,"2":287,"3":314},"2021":{"1":224,"2":224,"3":224}},"complete_target_identity_key":["source_id","site_id","origin_year_month","target_year_month","horizon_months"],"cross_group_pooling":"no_pooling","horizons_months":[1,2,3],"ordinal_completed_group_count":30,"ordinal_group_count":33,"ordinal_group_key":["model_id","model_seed","horizon_months"],"ordinal_unavailable_cutpoints":null,"ordinal_unavailable_group_count":3,"ordinal_unavailable_model_ids":["B0"],"ordinal_unavailable_status":"not_available_degenerate_constant_score","q_c_levels":[0.8,0.9,0.95],"q_c_record_count":90,"uncertainty_group_count":30,"uncertainty_group_key":["model_id","model_seed","horizon_months"],"uncertainty_model_ids":["A0","A1"]},"e7_terminal_record":{"base_seeds":[1729,20260612,20260613,20260614,314159],"checkpoint_or_model_write_count":0,"completed_metric_ids":["expert_anchor_fidelity","membership_stability","deterministic_computational_cost_proxy"],"completed_semantics":"anfis_module_fit_only_not_downstream_ablation","completed_training_rows_per_module":[4096],"computational_cost_proxy":"deterministic_update_count_and_sample_count_no_wall_clock","downstream_blockers":["P0_model_unavailable","P1_model_unavailable"],"downstream_metrics_status":"not_estimable_without_separate_temporal_consumers","e7_fit_identity_key":["experiment_id","training_rows_per_module","base_seed","module_id"],"eligible_rows_by_module":{"ANFIS-F":35273,"ANFIS-N":4757,"ANFIS-T-no-current":35419},"exact_record_per_required_size":true,"expected_completed_module_fit_count":15,"expected_completed_slot_count":5,"expected_preflight_record_count":45,"expected_resource_failure_record_count":10,"expected_slot_count":15,"experiment_id":"E7","expert_anchor_band_boundaries":[0.0,0.3333333333333333,0.6666666666666666,1.0],"expert_anchor_band_labels":["low","middle","high"],"expert_anchor_band_target_scope":"per_target_module","family80_no_touch":true,"historical_blockers_adopted":[{"bytes":46105,"e7_learning_curve_sizes_authorized":"not_declared","e7_learning_curve_status":"blocked_pending_sampling_strata_contract","git_mode":"100644","git_oid":"5970ab73eedb20f464f804a185a3057daba93ab3","path":"configs/closure_v1/development_runtime.yaml","sha256":"0b2588248ee006f7d8e8843291b6a5847201a36fed35422473c9c0aa9492b10d"},{"bytes":22694,"e7_learning_curve_sizes_authorized":"not_declared","e7_learning_curve_status":"blocked_for_separate_gate","git_mode":"100644","git_oid":"94f84be4346fd4e01fd52d207b932e21022fc436","path":"configs/closure_v1/anfis_ablation_training_development_runtime.yaml","sha256":"cf2cec52d9027db895e8859c7ffb321c831b66510132e137759e567b363f6a50"},{"bytes":21827,"e7_learning_curve_sizes_authorized":false,"e7_learning_curve_status":"blocked_for_separate_gate","git_mode":"100644","git_oid":"f9956fb51a8b0a742831c3400cc9624f4369fe90","path":"configs/closure_v1/anfis_ablation_sequence_development_runtime.yaml","sha256":"49d1a3f562f2cd68ff65f29c92ac4e028b3ad407f30a9960ea0d29260df7d56b"}],"historical_e7_blocker_adopted":true,"holdout_group_id_derivation":"source_id_double_colon_site_id_verified_against_assignment","new_e7_fit_count":15,"preflight_module_count_per_slot":3,"prelock_status":"pending_authorized_terminalization","primary_4096_hash_rank_reuse_forbidden":true,"primary_fit_reuse_count":0,"primary_fit_scope":"hash_rank_not_reused","required_training_rows_per_module":[4096,16384,65536],"resource_failure_timing":"pre_fit_exact_eligibility_check","resource_failure_training_rows_per_module":[16384,65536],"retain_completed_sizes_without_post_hoc_substitution":true,"sampling_strata":["holdout_group_id","temporal_period","expert_anchor_band"],"saturation_claim_authorized_if_incomplete":false,"silent_omission_allowed":false,"stratum_derivation_evidence":"boundaries_maps_and_sha256_digests_required","supersession_scope":"e7_only_additive_authority","temporal_period_derivation":"ordered_unique_eligible_month_index_floor_3i_over_n","temporal_period_labels":["early","middle","late"],"temporal_period_target_scope":"per_target_module_after_eligibility_filter","terminal_statuses":["completed","resource_failure_recorded"],"wall_clock_metric_authoritative":false},"experiment_id":"closure_v1","failed_attempt":{"active_guard_count":0,"attempted_gate":"E0-MCALC","authorization_consumed":true,"base_seed":1729,"development_2021_target_rows_opened":672,"dvc_commands_run":false,"failure_code":"selection_prediction_validator_rejected_calibration_threshold_role","filesystem_side_effect_count":0,"final_output_count":0,"holdout_rows_opened":false,"model_id":"A0","model_inference_performed":true,"outcome_paths_opened":false,"phase":"development_anfis_2021_inference_frame_construction","post_2021_rows_opened":false,"retry_authorized":false,"scientific_input_reads_performed":true,"status":"failed_closed_no_outputs","temporary_output_count":0},"gate":"E0-MCALD","generated_at_utc":"2026-08-11T15:34:17.462375+00:00","h_patch":{"added_count":5,"component_count":9,"components":[{"bytes":12980,"git_mode":"100644","git_oid":"00915b1719bc2520d7df0419ab93301f4568d663","path":"configs/closure_v1/final_calibration_inference_role_patch_lock.schema.json","role":"final_calibration_inference_role_patch_component","sha256":"8325194c0c81d6d9b611ed27ffbc98387daa8ab9afbab9923bb5f5a83c7346c3"},{"bytes":9463,"git_mode":"100644","git_oid":"3769dda3af7c30a518def85710f4420f04f3b438","path":"docs/closure_v1/E0_M_FINAL_CALIBRATION_INFERENCE_ROLE_PATCH_1.md","role":"final_calibration_inference_role_patch_component","sha256":"479008a078c97ee9f408901cdbf599bd178f0a7e17c54da2fb65456ea17a4fc4"},{"bytes":153974,"git_mode":"100644","git_oid":"6324e41e3cc10cfd4011f893d88dc696b901c475","path":"src/experiments/calibrate_closure_final_models.py","role":"final_calibration_inference_role_patch_component","sha256":"ee7615b8b572dd2129706a8bd1d0aa8c52d07b56886d097b22897705307ddcfa"},{"bytes":81948,"git_mode":"100644","git_oid":"5325edaa2fbbe73324e479011aeaea48cd09aa57","path":"src/experiments/closure_final_calibration_inference_role_patch.py","role":"final_calibration_inference_role_patch_component","sha256":"15ae3ad40048e28950ba45b566f750b41871722dc7e1589b2233db21c30e2e6b"},{"bytes":8853,"git_mode":"100644","git_oid":"321a2945dc81e2cc4297c2439e513548e4200e8d","path":"src/experiments/lock_closure_final_calibration_inference_role_patch.py","role":"final_calibration_inference_role_patch_component","sha256":"57ea0c7137c0eb3899ea36b3a59128a3aaa2c24966527b1aae3dcdbf226a96ce"},{"bytes":78284,"git_mode":"100644","git_oid":"a7ed4a99b28646f2f5a03ddc1387de63d37c0fe5","path":"src/experiments/run_closure_anfis_learning_curve.py","role":"final_calibration_inference_role_patch_component","sha256":"54c37941b18fd6b3d9ae329d8479b38b561780fbe0d8451027a3a658f9fa6e00"},{"bytes":86679,"git_mode":"100644","git_oid":"4b94cc967339774ed02d13b2f123d12587b57acd","path":"tests/test_calibrate_closure_final_models.py","role":"final_calibration_inference_role_patch_component","sha256":"ed2e545ed1bb8a509cad0c91aa96537ba321eadd931cb7944e48cb7eac042a55"},{"bytes":61575,"git_mode":"100644","git_oid":"62ea27a1c48ffc1d4198de0563c0d8c7ea1098a5","path":"tests/test_closure_anfis_learning_curve.py","role":"final_calibration_inference_role_patch_component","sha256":"703d8f980655dd3712232bcde4f015dfc8b7cec232b82ff599224aab825e88fa"},{"bytes":34774,"git_mode":"100644","git_oid":"bcd32f34b69b170cec03447a21a9a6108ec6a667","path":"tests/test_closure_final_calibration_inference_role_patch.py","role":"final_calibration_inference_role_patch_component","sha256":"2911c39a0caad36b24a43c68399a0a7e43035252e89490690f03aa62302505e5"}],"components_sha256":"67659f06a949e206936365c9b31780eb364056ed603e847c8418d938b915df22","gate":"H-E0-MCALD","modified_count":4},"inference_role_contract":{"base_seeds":[1729,20260612,20260613,20260614,314159],"model_ids":["A0","A1"],"origin_count":224,"row_count_per_slot":672,"scientific_data_rewritten":false,"selection_artifacts_rewritten":false,"target_period":{"end":"2021-12","start":"2021-01"},"time_role":"calibration_threshold","trainer_selection_contract_preserved":true},"model_matrix":{"available_calibrable_count":6,"available_not_applicable_count":2,"model_count":11,"ordered_model_ids":["B0","B1","B2","F0","F1","P0","P1","M0","A0","A1","A2"],"records":[{"availability":"available","availability_reason":"published_deterministic_baseline","bloom_calibration":"fixed_identity_no_refit","bloom_score_source":"predicted_bloom_probability","calibration_seed_source":"technical_seed","horizons_months":[1,2,3],"model_id":"B0","ordinal_calibration":"record_not_available_degenerate_constant_score","seed_policy":"deterministic_technical_seed","seeds":[1729],"selected_family":false,"uncertainty_calibration":"not_applicable"},{"availability":"available","availability_reason":"published_seeded_baseline_family","bloom_calibration":"select_then_refit","bloom_score_source":"predicted_bloom_probability","calibration_seed_source":"upstream_state_seed","horizons_months":[1,2,3],"model_id":"B1","ordinal_calibration":"select_cutpoints","seed_policy":"exact_five_prespecified_seeds","seeds":[1729,20260612,20260613,20260614,314159],"selecte